{
  "$defs": {
    "CaptureProducer": {
      "additionalProperties": false,
      "properties": {
        "instance_id": {
          "format": "uuid",
          "type": "string"
        },
        "type": {
          "type": "string"
        }
      },
      "required": [
        "type",
        "instance_id"
      ],
      "type": "object"
    },
    "EnvironmentById": {
      "additionalProperties": false,
      "properties": {
        "id": {
          "format": "uuid",
          "type": "string"
        }
      },
      "required": [
        "id"
      ],
      "type": "object"
    },
    "EnvironmentByName": {
      "additionalProperties": false,
      "properties": {
        "name": {
          "type": "string"
        }
      },
      "required": [
        "name"
      ],
      "type": "object"
    },
    "EnvironmentRef": {
      "anyOf": [
        {
          "$ref": "#/$defs/EnvironmentById"
        },
        {
          "$ref": "#/$defs/EnvironmentByName"
        }
      ]
    }
  },
  "$schema": "https://json-schema.org/draft/2020-12/schema",
  "additionalProperties": false,
  "properties": {
    "batch_id": {
      "format": "uuid",
      "type": "string"
    },
    "environment": {
      "$ref": "#/$defs/EnvironmentRef"
    },
    "project_id": {
      "format": "uuid",
      "type": "string"
    },
    "records": {
      "items": true,
      "type": "array",
      "minItems": 1,
      "maxItems": 50
    },
    "schema_version": {
      "const": "3"
    },
    "source": {
      "$ref": "#/$defs/CaptureProducer"
    }
  },
  "required": [
    "schema_version",
    "batch_id",
    "project_id",
    "environment",
    "source",
    "records"
  ],
  "title": "CaptureBatch",
  "type": "object"
}
