{
  "schema_version": "3",
  "batch_id": "01000000-0000-0000-0000-000000000001",
  "project_id": "20000000-0000-4000-8000-000000000001",
  "source": {
    "type": "chrome_extension",
    "instance_id": "01000000-0000-0000-0000-000000000002"
  },
  "records": [
    {
      "record_id": "01000000-0000-0000-0000-00000000000a",
      "kind": "page_context",
      "payload_version": "1",
      "captured_at": "2026-09-16T10:00:00Z",
      "context": {
        "browser_instance_id": "01000000-0000-0000-0000-000000000003",
        "page_instance_id": "01000000-0000-0000-0000-000000000004",
        "frame_instance_id": "01000000-0000-0000-0000-000000000005",
        "view_id": "01000000-0000-0000-0000-000000000006",
        "page_url": "https://portal.example.test/orders",
        "event_seq": 10,
        "interaction_id": null
      },
      "payload": {
        "url": "https://portal.example.test/orders",
        "title": "订单查询",
        "breadcrumbs": [],
        "regions": [],
        "complete": false,
        "limitations": [
          "PAGE_METADATA_ONLY"
        ]
      }
    },
    {
      "record_id": "01000000-0000-0000-0000-00000000000b",
      "kind": "interaction",
      "payload_version": "1",
      "captured_at": "2026-09-16T10:00:01Z",
      "context": {
        "browser_instance_id": "01000000-0000-0000-0000-000000000003",
        "page_instance_id": "01000000-0000-0000-0000-000000000004",
        "frame_instance_id": "01000000-0000-0000-0000-000000000005",
        "view_id": "01000000-0000-0000-0000-000000000006",
        "page_url": "https://portal.example.test/orders",
        "event_seq": 11,
        "interaction_id": "01000000-0000-0000-0000-000000000014"
      },
      "payload": {
        "action": "change",
        "target": {
          "element_id": "status",
          "tag": "select",
          "role": "combobox",
          "name": "status",
          "label": "订单状态",
          "visible": true,
          "bounds": null,
          "value": {
            "state": "present",
            "value": "1"
          },
          "options": [
            {
              "label": "待审核",
              "value": {
                "state": "present",
                "value": "1"
              },
              "selected": true
            }
          ]
        },
        "complete": false,
        "limitations": [
          "OPTIONS_MAY_BE_PARTIAL"
        ]
      }
    },
    {
      "record_id": "01000000-0000-0000-0000-00000000000c",
      "kind": "interaction",
      "payload_version": "1",
      "captured_at": "2026-09-16T10:00:05Z",
      "context": {
        "browser_instance_id": "01000000-0000-0000-0000-000000000003",
        "page_instance_id": "01000000-0000-0000-0000-000000000004",
        "frame_instance_id": "01000000-0000-0000-0000-000000000005",
        "view_id": "01000000-0000-0000-0000-000000000006",
        "page_url": "https://portal.example.test/orders",
        "event_seq": 12,
        "interaction_id": "01000000-0000-0000-0000-000000000015"
      },
      "payload": {
        "action": "click",
        "target": {
          "element_id": "query",
          "tag": "button",
          "role": "button",
          "label": "查询",
          "visible": true,
          "value": {
            "state": "unknown",
            "value": null
          },
          "options": []
        },
        "complete": false,
        "limitations": [
          "ASYNC_OPERATION_UNATTRIBUTED"
        ]
      }
    },
    {
      "record_id": "01000000-0000-0000-0000-00000000000d",
      "kind": "ui_snapshot",
      "payload_version": "1",
      "captured_at": "2026-09-16T10:00:05Z",
      "context": {
        "browser_instance_id": "01000000-0000-0000-0000-000000000003",
        "page_instance_id": "01000000-0000-0000-0000-000000000004",
        "frame_instance_id": "01000000-0000-0000-0000-000000000005",
        "view_id": "01000000-0000-0000-0000-000000000006",
        "page_url": "https://portal.example.test/orders",
        "event_seq": 13,
        "interaction_id": "01000000-0000-0000-0000-000000000015"
      },
      "payload": {
        "elements": [
          {
            "element_id": "status",
            "tag": "select",
            "role": "combobox",
            "name": "status",
            "label": "订单状态",
            "visible": true,
            "bounds": null,
            "value": {
              "state": "present",
              "value": "1"
            },
            "options": [
              {
                "label": "待审核",
                "value": {
                  "state": "present",
                  "value": "1"
                },
                "selected": true
              }
            ]
          }
        ],
        "complete": false,
        "limitations": [
          "LOCAL_FORM_ONLY",
          "OPTIONS_MAY_BE_PARTIAL",
          "ASYNC_OPERATION_UNATTRIBUTED"
        ]
      }
    },
    {
      "record_id": "01000000-0000-0000-0000-00000000000e",
      "kind": "http_exchange",
      "payload_version": "1",
      "captured_at": "2026-09-16T10:00:05.200000Z",
      "context": {
        "browser_instance_id": "01000000-0000-0000-0000-000000000003",
        "page_instance_id": "01000000-0000-0000-0000-000000000004",
        "frame_instance_id": "01000000-0000-0000-0000-000000000005",
        "view_id": "01000000-0000-0000-0000-000000000006",
        "page_url": "https://portal.example.test/orders",
        "event_seq": 14,
        "interaction_id": "01000000-0000-0000-0000-000000000015",
        "request_started_at_ms": 1789552805001,
        "response_completed_at_ms": 1789552805200
      },
      "payload": {
        "request": {
          "method": "POST",
          "url": "https://api.example.test/orders/query",
          "url_truncated": false,
          "headers": {
            "state": "page-visible",
            "entries": [
              [
                "Content-Type",
                "application/json"
              ]
            ]
          },
          "body": {
            "state": "complete",
            "encoding": "text",
            "content": "{\"status\":1}",
            "bytes": 12
          }
        },
        "response": {
          "state": "complete",
          "status": 200,
          "url": "https://api.example.test/orders/query",
          "headers": {
            "state": "page-visible",
            "entries": [
              [
                "Content-Type",
                "application/json"
              ],
              [
                "Set-Cookie",
                "synthetic-cookie=example"
              ]
            ]
          },
          "body": {
            "state": "complete",
            "encoding": "text",
            "content": "{\"items\":[{\"id\":1,\"name\":\"example\"}]}",
            "bytes": 37
          }
        },
        "source_page": "https://portal.example.test/orders",
        "transport": "fetch",
        "frame": "page"
      }
    },
    {
      "record_id": "01000000-0000-0000-0000-00000000000f",
      "kind": "http_exchange",
      "payload_version": "1",
      "captured_at": "2026-09-16T10:00:06.200000Z",
      "context": {
        "browser_instance_id": "01000000-0000-0000-0000-000000000003",
        "page_instance_id": "01000000-0000-0000-0000-000000000004",
        "frame_instance_id": "01000000-0000-0000-0000-000000000005",
        "view_id": "01000000-0000-0000-0000-000000000006",
        "page_url": "https://portal.example.test/orders",
        "event_seq": 15,
        "interaction_id": null,
        "request_started_at_ms": 1789552806000,
        "response_completed_at_ms": 1789552806200
      },
      "payload": {
        "request": {
          "method": "POST",
          "url": "https://api.example.test/notifications/poll",
          "url_truncated": false,
          "headers": {
            "state": "page-visible",
            "entries": [
              [
                "Content-Type",
                "application/json"
              ]
            ]
          },
          "body": {
            "state": "complete",
            "encoding": "text",
            "content": "{\"status\":1}",
            "bytes": 12
          }
        },
        "response": {
          "state": "complete",
          "status": 200,
          "url": "https://api.example.test/notifications/poll",
          "headers": {
            "state": "page-visible",
            "entries": [
              [
                "Content-Type",
                "application/json"
              ],
              [
                "Set-Cookie",
                "synthetic-cookie=example"
              ]
            ]
          },
          "body": {
            "state": "complete",
            "encoding": "text",
            "content": "{\"items\":[{\"id\":1,\"name\":\"example\"}]}",
            "bytes": 37
          }
        },
        "source_page": "https://portal.example.test/orders",
        "transport": "fetch",
        "frame": "page"
      }
    }
  ],
  "environment": {
    "name": "开发环境"
  }
}
