{
  "schema_version": "3",
  "batch_id": "463f3c40-fef5-4cca-b3d6-91fde7d077d9",
  "project_id": "20000000-0000-4000-8000-000000000001",
  "source": {
    "type": "chrome_extension",
    "instance_id": "b8689953-a301-42eb-9b62-28ae3013636d"
  },
  "records": [
    {
      "record_id": "3b947d94-968f-423d-8474-5250a8ceed7c",
      "kind": "interaction",
      "payload_version": "1",
      "captured_at": "2026-09-16T10:00:05Z",
      "context": {
        "browser_instance_id": "01000000-0000-0000-0000-000000000003",
        "page_instance_id": "01000000-0000-0000-0000-000000000004",
        "frame_instance_id": "01000000-0000-0000-0000-000000000005",
        "view_id": "01000000-0000-0000-0000-000000000006",
        "page_url": "https://portal.example.test/workspace",
        "event_seq": 1,
        "interaction_id": "01000000-0000-0000-0000-000000000015"
      },
      "payload": {
        "action": "click",
        "target": {
          "element_id": "query",
          "tag": "button",
          "role": "button",
          "label": "查询",
          "visible": true,
          "value": {
            "state": "unknown",
            "value": null
          },
          "options": []
        },
        "complete": false,
        "limitations": [
          "ASYNC_OPERATION_UNATTRIBUTED"
        ]
      }
    },
    {
      "record_id": "cb92a739-4863-4a5f-b2f0-4bcd03bf832d",
      "kind": "ui_snapshot",
      "payload_version": "1",
      "captured_at": "2026-09-16T10:00:05Z",
      "context": {
        "browser_instance_id": "01000000-0000-0000-0000-000000000003",
        "page_instance_id": "01000000-0000-0000-0000-000000000004",
        "frame_instance_id": "01000000-0000-0000-0000-000000000005",
        "view_id": "01000000-0000-0000-0000-000000000006",
        "page_url": "https://portal.example.test/workspace",
        "event_seq": 2,
        "interaction_id": "01000000-0000-0000-0000-000000000015"
      },
      "payload": {
        "elements": [
          {
            "element_id": "status",
            "tag": "select",
            "role": "combobox",
            "name": "status",
            "label": "订单状态",
            "visible": true,
            "bounds": null,
            "value": {
              "state": "present",
              "value": "1"
            },
            "options": [
              {
                "label": "待审核",
                "value": {
                  "state": "present",
                  "value": "1"
                },
                "selected": true
              }
            ]
          }
        ],
        "complete": false,
        "limitations": [
          "LOCAL_FORM_ONLY",
          "OPTIONS_MAY_BE_PARTIAL",
          "ASYNC_OPERATION_UNATTRIBUTED"
        ]
      }
    },
    {
      "record_id": "74623f1a-1b2b-4738-9c17-5f490779e165",
      "kind": "interaction",
      "payload_version": "1",
      "captured_at": "2026-09-16T10:00:06Z",
      "context": {
        "browser_instance_id": "01000000-0000-0000-0000-000000000003",
        "page_instance_id": "01000000-0000-0000-0000-000000000004",
        "frame_instance_id": "01000000-0000-0000-0000-000000000005",
        "view_id": "01000000-0000-0000-0000-000000000006",
        "page_url": "https://portal.example.test/workspace",
        "event_seq": 4,
        "interaction_id": "0cf25893-05c9-43c9-b65a-09e81cd6e95e"
      },
      "payload": {
        "action": "click",
        "target": {
          "element_id": "inventory-query",
          "tag": "button",
          "role": "button",
          "label": "库存查询",
          "visible": true,
          "value": {
            "state": "unknown",
            "value": null
          },
          "options": []
        },
        "complete": false,
        "limitations": [
          "ASYNC_OPERATION_UNATTRIBUTED"
        ]
      }
    },
    {
      "record_id": "5704d0d8-6c74-4a71-a014-055b514916b6",
      "kind": "ui_snapshot",
      "payload_version": "1",
      "captured_at": "2026-09-16T10:00:06Z",
      "context": {
        "browser_instance_id": "01000000-0000-0000-0000-000000000003",
        "page_instance_id": "01000000-0000-0000-0000-000000000004",
        "frame_instance_id": "01000000-0000-0000-0000-000000000005",
        "view_id": "01000000-0000-0000-0000-000000000006",
        "page_url": "https://portal.example.test/workspace",
        "event_seq": 5,
        "interaction_id": "0cf25893-05c9-43c9-b65a-09e81cd6e95e"
      },
      "payload": {
        "elements": [
          {
            "element_id": "inventory-status",
            "tag": "select",
            "role": "combobox",
            "name": "status",
            "label": "订单状态",
            "visible": true,
            "bounds": null,
            "value": {
              "state": "present",
              "value": "2"
            },
            "options": [
              {
                "label": "可用",
                "value": {
                  "state": "present",
                  "value": "2"
                },
                "selected": true
              }
            ]
          }
        ],
        "complete": false,
        "limitations": [
          "LOCAL_FORM_ONLY",
          "OPTIONS_MAY_BE_PARTIAL",
          "ASYNC_OPERATION_UNATTRIBUTED"
        ]
      }
    },
    {
      "record_id": "27174d82-f388-49ec-b498-8f53425d8970",
      "kind": "http_exchange",
      "payload_version": "1",
      "captured_at": "2026-09-16T10:00:06.001000Z",
      "context": {
        "browser_instance_id": "01000000-0000-0000-0000-000000000003",
        "page_instance_id": "01000000-0000-0000-0000-000000000004",
        "frame_instance_id": "01000000-0000-0000-0000-000000000005",
        "view_id": "01000000-0000-0000-0000-000000000006",
        "page_url": "https://portal.example.test/workspace",
        "event_seq": 6,
        "interaction_id": "0cf25893-05c9-43c9-b65a-09e81cd6e95e",
        "request_started_at_ms": 1789552806001,
        "response_completed_at_ms": 1789552806301
      },
      "payload": {
        "request": {
          "method": "POST",
          "url": "https://api.example.test/inventory/search",
          "url_truncated": false,
          "headers": {
            "state": "page-visible",
            "entries": [
              [
                "Content-Type",
                "application/json"
              ]
            ]
          },
          "body": {
            "state": "complete",
            "encoding": "text",
            "content": "{\"status\":2}",
            "bytes": 12
          }
        },
        "response": {
          "state": "complete",
          "status": 200,
          "url": "https://api.example.test/inventory/search",
          "headers": {
            "state": "page-visible",
            "entries": [
              [
                "Content-Type",
                "application/json"
              ],
              [
                "Set-Cookie",
                "synthetic-cookie=example"
              ]
            ]
          },
          "body": {
            "state": "complete",
            "encoding": "text",
            "content": "{\"items\":[{\"id\":1,\"name\":\"example\"}]}",
            "bytes": 37
          }
        },
        "source_page": "https://portal.example.test/workspace",
        "transport": "fetch",
        "frame": "page"
      }
    },
    {
      "record_id": "81c906dc-d3f8-4d13-a6c9-66e4bb8caf3a",
      "kind": "http_exchange",
      "payload_version": "1",
      "captured_at": "2026-09-16T10:00:05.001000Z",
      "context": {
        "browser_instance_id": "01000000-0000-0000-0000-000000000003",
        "page_instance_id": "01000000-0000-0000-0000-000000000004",
        "frame_instance_id": "01000000-0000-0000-0000-000000000005",
        "view_id": "01000000-0000-0000-0000-000000000006",
        "page_url": "https://portal.example.test/workspace",
        "event_seq": 3,
        "interaction_id": "01000000-0000-0000-0000-000000000015",
        "request_started_at_ms": 1789552805001,
        "response_completed_at_ms": 1789552810200
      },
      "payload": {
        "request": {
          "method": "POST",
          "url": "https://api.example.test/orders/query",
          "url_truncated": false,
          "headers": {
            "state": "page-visible",
            "entries": [
              [
                "Content-Type",
                "application/json"
              ]
            ]
          },
          "body": {
            "state": "complete",
            "encoding": "text",
            "content": "{\"status\":1}",
            "bytes": 12
          }
        },
        "response": {
          "state": "complete",
          "status": 200,
          "url": "https://api.example.test/orders/query",
          "headers": {
            "state": "page-visible",
            "entries": [
              [
                "Content-Type",
                "application/json"
              ],
              [
                "Set-Cookie",
                "synthetic-cookie=example"
              ]
            ]
          },
          "body": {
            "state": "complete",
            "encoding": "text",
            "content": "{\"items\":[{\"id\":1,\"name\":\"example\"}]}",
            "bytes": 37
          }
        },
        "source_page": "https://portal.example.test/workspace",
        "transport": "fetch",
        "frame": "page"
      }
    }
  ],
  "environment": {
    "name": "开发环境"
  }
}
